age,gender,genderOther,race,raceOther,education,educationOther,country,politicalOrientation,experience,engagement,clearity,interference,interferenceOption,keyFactors,strategy,motivation,followUp,additionalFeedback,experienceDetails,familiarityUniversities,employmentStatus,employmentStatusOther,hiringInvolved,hiringExperienceYears,playerID
54,Male,,Caucasian,,College,,usa,Slightly Liberal,No,Slightly Engaging,Very Clear,,No,highest success rate,based on the ratio success and failure,money,Yes,,,"['Heidelberg University', 'University of Glasgow', 'University of Nottingham', 'Karlsruhe Institute of Technology']",Employed full-time,,Yes,7+ years,01KCQ4P948E9T06J87G9ZHY070
33,Male,,Caucasian,,College,,USA,Extremely Liberal,No,Moderately Engaging,Moderately Clear,,No,The highest average of successes to failures,Looked at the success and failure rates overall,Availability,Yes,,,['None of the above'],Employed full-time,,Yes,7+ years,01KCQ4SK2EJAGZHFFX156NSYT1
27,Male,,Asian,,College,,United States,Slightly Liberal,Yes,Very Engaging,Very Clear,,No,I wanted to find the highest success rate quickly. The fear of variation and missing out kept me from trying other schools once I found one with a good success rate,"I went one by one through the schools until one gave me consistent success rates. Once I found one, I stayed with it and and didn't choose any others",I thought it would be fun and engaging. I had some time to pass.,Yes,I had a lot of fun with this. Not sure I did super well as my methodology probably wasn't the best.,I completed a similar study where we could see what the other participants chose.,['None of the above'],Employed full-time,,Yes,1–3 years,01KCQ4NTG3053KQV8QN5K10PNY
35,Male,,Caucasian,,College,,usa,Extremely Liberal,No,Very Engaging,Very Clear,,No,the ration of success versus failures ,I stuck with ones that were giving me success and moved on when they werent,Finical gain,Yes,,,"['University of Glasgow', 'University of Leeds']",Employed full-time,,No,,01KCQ4QGATEDXKA69P6KXZE63B
27,Female,,Latin/x,,Some College,,USA,Slightly Conservative,Yes,Engaging,Very Clear,,No,Success to Fail ratios.,I selected randomly to see how the ratios would change first.,I wanted to see how ratios would change.,Yes,,Earlier today. Similar but a bit different.,"['Trinity College Dublin', 'University of Glasgow', 'University of Adelaide', 'University of Leeds', 'University of Nottingham']",Employed part-time,,Yes,Less than 1 year,01KCQ4V1S87PZK0B8X8Z6A0HD7
28,Female,,Caucasian,,High School,,United States,Slightly Liberal,No,Engaging,Clear,,No,How many successful candidates the university had previously,Initially I was just trying every university out to see which ones had successful candidates. I kept choosing the same university until I felt like the ratio of successful to unsuccessful students candidates wasn't good anymore,Very!,Yes,,,['None of the above'],Employed full-time,,Yes,1–3 years,01KCQ4W4B7NB48NTQQKV36MSSZ
56,Male,,Caucasian,,College,,USA,Extremely Liberal,Yes,Engaging,Clear,,No,Again I once I found that the University of Leeds always hit I stuck with it.,"I first hunted around, but once I found the one that always hit, I stuck with it. ",$5 payment,Yes,Fun and interesting study. I would be happy to do more like it.,"I don't remember exactly when or who was giving it, but I have done similar studies on Connect and Prolific before",['None of the above'],Employed full-time,,Yes,7+ years,01KCQ4WQ5DF51EKSTNJ24WTHJF
51,Female,,Caucasian,,High School,,USA,Slightly Liberal,No,Engaging,Very Clear,,No,"Mostly the success rate, i did not pay much attention to failures, if the success rate was high. In my case, i made a good decision early on in the study, and stuck with it (Dublin)",I decided to stick with the college that had the highest rate of success and the lowest failure rate.,I thought it sounded interesting and i wanted to see if i could make at least half a decent decision between all the colleges.,Yes,"Fun study, thank you for allowing me to be a part of it!",,['None of the above'],Employed full-time,,No,,01KCQ51RMS1Y4DPX2N39JHSEZE
